{
  "tuple_type": "BIO_OUTCOME_OBSERVED",
  "subject_id": "operator-001",
  "run_id": "bio-run-001",
  "control_mode": "HOTL",
  "tuple_data": {
    "action_id": "bio-action-001",
    "outcome_type": "operator_state_improved",
    "observed_change": "self_reported_eye_strain_decreased_and_work_pace_stabilized",
    "measurement_basis": [
      "followup_self_report",
      "reduced_error_rate",
      "lower_perceived_workload"
    ],
    "confidence": 0.66
  }
}
